{
  "schemaVersion": "0.1.0",
  "recordId": "pilot-0150-vs-0151-20260901T101701Z",
  "producedAt": "2026-09-01T10:17:01Z",
  "producer": {
    "name": "qualock",
    "commit": "d6da463afff65ceb139dcf6ce94aaf766f9abd01"
  },
  "subject": {
    "name": "codex",
    "version": "0.151.0",
    "hashes": [
      {
        "alg": "SHA-256",
        "content": "9739cbc928b9c573be83256acd46668f5dd4f119d2d09e05246895ca2aaf0c9a",
        "of": "main-binary"
      }
    ]
  },
  "comparedWith": {
    "name": "codex",
    "version": "0.150.0",
    "hashes": [
      {
        "alg": "SHA-256",
        "content": "f0222a59e7d06f7b97014fb672731285b453b945fc0f0aab36c89278dec36e14",
        "of": "main-binary"
      }
    ]
  },
  "environment": {
    "containerImageDigest": "sha256:85d4cb1afa769a7338e095b927bee941cf5ec92266c7424b3f6c0f2748567248",
    "containerImageRef": "ghcr.io/astral-sh/uv:0.9.30-python3.12-bookworm",
    "osArch": "linux/amd64",
    "model": {
      "id": "gpt-5.6-terra",
      "reasoningEffort": "high"
    },
    "isolation": {
      "networkEgress": "denied",
      "webSearch": "disabled",
      "disabledAgentFeatures": [
        "apps",
        "plugins",
        "remote_plugin"
      ],
      "containerPrivileged": false,
      "containerSysAdmin": false,
      "notes": "Workspace network disabled and web search disabled, recorded as runner.workspace_network=false and runner.web_search=disabled. Seccomp was unconfined (runner.agent_security_opt=seccomp=unconfined): that is a real relaxation and is declared here rather than left implied by the two flags above.",
      "seccomp": "unconfined"
    }
  },
  "method": {
    "kind": "paired-interleaved-canary",
    "attempts": 18,
    "attemptsPerVariant": 9,
    "graderVisibility": "hidden-until-grading",
    "invalidatedAttempts": 0,
    "provider": "authenticated"
  },
  "canaries": [
    {
      "id": "starlette-url-empty-authority",
      "upstreamRepository": "https://github.com/Kludex/starlette.git",
      "baseCommit": "4a18cd4a0869158f830e9bf519979d6f6f60f36a",
      "preparedImageDigest": "sha256:f8a11f28b27ff0c2286a25412b0ba33fe2ac2fc7d7b09ed854bd30ff0f61f453",
      "sourceIsolation": {
        "headMatchesBase": true,
        "refCount": 0,
        "remoteCount": 0,
        "unreachableObjectCount": 0
      }
    },
    {
      "id": "pytest-xdist-loadgroup-crash-recovery",
      "upstreamRepository": "https://github.com/pytest-dev/pytest-xdist.git",
      "baseCommit": "dd198c35710f22b1cb86b7fc00311f9b7c63d665",
      "preparedImageDigest": "sha256:2f384af8c72c08042691d93fc4f0f5413e487fc86bdf02a7a3d53a1f9614fb1d",
      "sourceIsolation": {
        "headMatchesBase": true,
        "refCount": 0,
        "remoteCount": 0,
        "unreachableObjectCount": 0
      }
    },
    {
      "id": "click-sentinel-duplication",
      "upstreamRepository": "https://github.com/pallets/click.git",
      "baseCommit": "3cbcf9b11546f4cf10b36d3e2e531733ba6fe001",
      "preparedImageDigest": "sha256:23e5da6a6af10e2e053b95740d1c8a3a9f4de42b5e4cbb11a0bdfe6e7bced02c",
      "sourceIsolation": {
        "headMatchesBase": true,
        "refCount": 0,
        "remoteCount": 0,
        "unreachableObjectCount": 0
      }
    }
  ],
  "observation": {
    "verdict": "PASS",
    "verdictRationale": "All three canaries passed 3/3 on both releases: 18 valid attempts in total, 9 per release. No regression claim is made beyond this suite.",
    "perVariant": {
      "0.150.0": {
        "starlette-url-empty-authority": [
          true,
          true,
          true
        ],
        "pytest-xdist-loadgroup-crash-recovery": [
          true,
          true,
          true
        ],
        "click-sentinel-duplication": [
          true,
          true,
          true
        ]
      },
      "0.151.0": {
        "starlette-url-empty-authority": [
          true,
          true,
          true
        ],
        "pytest-xdist-loadgroup-crash-recovery": [
          true,
          true,
          true
        ],
        "click-sentinel-duplication": [
          true,
          true,
          true
        ]
      }
    },
    "advisoryMetrics": {
      "runtimeDeltaPct": -16.9,
      "inputTokenDeltaPct": -27.2
    }
  },
  "claimScope": {
    "establishes": "Across these three canaries, under this model and environment, codex 0.151.0 did not regress relative to 0.150.0 in 18 valid paired attempts. Source isolation held: 0 of 18 attempts referenced a non-base commit.",
    "doesNotEstablish": "Behaviour under any other feature-flag combination, model, canary or environment. It does not establish safety, and it did NOT detect the managed-shell command-tool regression that exists between these same two binaries. It also does not control for service-side model changes: under authenticated access the served model snapshot cannot be independently pinned, so a change in model serving remains a residual confounder that this design cannot exclude.",
    "knownCoverageGaps": [
      "The default qualification path never established shell_tool=true with unified_exec=false, which is the precondition under which the managed-shell regression manifests. See the companion version-bisect record.",
      "Seccomp was unconfined during the agent phase, so the sandbox was weaker than the privileged and SYS_ADMIN flags alone suggest."
    ]
  },
  "evidence": {
    "bundlePath": "docs/evidence/2026-09-01-codex-0.150.0-vs-0.151.0-clean-rerun/",
    "reproduceCommand": "requires authenticated provider access; see the bundle README. Unlike the managed-shell case this run is not reproducible without credentials.",
    "verifierCommand": "none published for this bundle - it contains README.md and evidence.json only, with no SHA256SUMS. Verification is by reading evidence.json: the recorded binary hashes, prepared image digests and source_isolation fields. Do not expect a checksum file here; the managed-shell bundle has one, this one does not."
  },
  "supersedes": {
    "bundlePath": "docs/evidence/2026-09-01-codex-0.150.0-vs-0.151.0/",
    "hashes": [
      {
        "alg": "SHA-256",
        "content": "bf69ecea40dc282079ba35386614e7ff74173657a697854e7a90e01a5329f03f",
        "of": "evidence-json"
      }
    ],
    "reason": "The first execution of this comparison was contaminated by historical Git source isolation leakage, found by auditing event logs for references to non-base commits. It was fixed and rerun; the contaminated bundle is retained rather than deleted so the correction stays auditable."
  }
}
